slug,firm_name,short_description,founding_year,team_size_label,office_locations,languages,jurisdictions,practice_areas,website,sources,key_lawyer_slugs,verified,featured,status
be-legal-advocates,be.legal Advocates,"Multi-disciplinary firm founded 2008 with specialized iGaming practice. Handles MGA applications, license compliance, ongoing regulatory support for operators.",2008,11-50,"St. Julian's, Malta",English; Maltese,malta,licensing;regulatory-compliance;corporate-ma,https://belegal.com.mt/,https://belegal.com.mt/malta-law-services/online-and-remote-gaming/ | https://belegal.com.mt/about-law-firm/,,true,false,published
camilleri-preziosi,Camilleri Preziosi,Leading Valletta-based firm established in 1960s with Band 1 ranking in General Business Law. Advises gaming clients across regulatory compliance and M&A.,,51-200,"Valletta, Malta",English; Maltese,malta,licensing;regulatory-compliance;corporate-ma;aml-kyc,https://camilleripreziosi.com/,https://camilleripreziosi.com/ | https://www.legal500.com/firms/10105-camilleri-preziosi/10111-valletta-malta/,,true,true,published
chetcuti-cauchi-advocates,Chetcuti Cauchi Advocates,"One of Malta's largest law firms with comprehensive gaming and iGaming practice. Provides end-to-end licensing, compliance, and corporate advisory services to gaming operators and platforms.",2004,51-200,"Valletta, Malta; Birkirkara, Malta",English; Maltese,malta,licensing;regulatory-compliance;corporate-ma;commercial-contracts;tax,https://www.ccmalta.com/,https://www.ccmalta.com/practices/igaming-law | https://www.linkedin.com/company/chetcuti-cauchi-advocates,,true,false,published
df-advocates,DF Advocates,"Founded 2003, this Sliema-based firm specializes in gaming operations and IT setup. Advises international clients on regulatory compliance and startup requirements in Malta's gaming sector.",2003,11-50,"Sliema, Malta",English,malta,licensing;regulatory-compliance;corporate-ma,https://dfadvocates.com/,https://dfadvocates.com/expertice/gaming-and-betting/ | https://mt.linkedin.com/company/df-advocates,,true,false,published
ellul-schranz-e-and-s-group,Ellul Schranz (E&S Group),Specialized firm with 15+ years iGaming experience. Assists operators with MGA licensing process and regulatory compliance in Malta's gaming sector.,,1-10,Malta,English,malta,licensing;regulatory-compliance,https://www.ellulschranz.com/,https://www.ellulschranz.com/igaming-license-malta-2024/ | https://www.ellulschranz.com/about/,,true,false,published
emd-advocates,EMD Advocates,"Established multidisciplinary firm with niche expertise in Malta gaming law, financial services, and trust law. Provides legal, tax, and advisory services to gaming sector.",,11-50,"Valletta, Malta",English; Maltese,malta,licensing;regulatory-compliance;tax;corporate-ma,https://www.emd.com.mt/,https://www.emd.com.mt/brochures/en/remote_gaming_malta_vb1.html | https://www.legal500.com/firms/10069-emd-advocates/c-malta/about,,true,false,published
gg-advocates,GG Advocates,Valletta-based firm (Grech & Ghaznavi) with e-gaming law expertise among broader multidisciplinary practice. Experienced in gaming regulation and compliance.,,11-50,"Valletta, Malta",English; Maltese,malta,regulatory-compliance;commercial-contracts,http://www.ggadvocates.com/,http://www.ggadvocates.com/service/e-gaming | https://www.zoominfo.com/c/gg-advocates/348828398,,true,false,published
gonzi-and-associates,Gonzi & Associates,"Boutique firm specializing in gaming law for both land-based and remote operations. Expert in licensing, gaming approvals, and compliance with 13+ years of sector experience.",1976,1-10,"Valletta, Malta",English; Maltese,malta,licensing;regulatory-compliance;corporate-ma,https://gonzi.com.mt/,https://gonzi.com.mt/gaming-it-telecoms/gaming-and-betting-law/ | https://gonzi.com.mt/about/,,true,false,published
gtg-legal,GTG Legal,"Technology-focused firm established in 1997, pioneering in gaming law with dedicated practice advising remote gaming licensees. Expertise in M&A, fintech, and emerging tech in gaming sector.",1997,11-50,"Valletta, Malta",English; Maltese,malta,licensing;regulatory-compliance;corporate-ma;intellectual-property;litigation-disputes,https://gtg.com.mt/,https://gtg.com.mt/practice-areas/gaming-and-betting-law/ | https://chambers.com/law-firm/gtg-legal-europe-7:3164,,true,false,published
gvzh-advocates,GVZH Advocates,"Top-tier Maltese law firm specializing in gaming law with deep expertise in MGA licensing, regulatory compliance, and advising major gaming operators. Among the first to establish Malta as a gaming regulatory hub.",,51-200,"Valletta, Malta",English; Maltese,malta,licensing;regulatory-compliance;aml-kyc;corporate-ma;litigation-disputes,https://gvzh.mt/,https://gvzh.mt/services/practice-areas/igaming/ | https://www.legal500.com/firms/11777-gvzh-advocates/c-malta/about,,true,true,published
iuris-malta,IURIS Malta,"Gaming and betting law specialists founded 2011. Assists operators with licensing, corporate requirements, and compliance in the remote gaming sector; advocates for responsible gaming.",2011,1-10,"Valletta, Malta; Victoria, Gozo",English; Maltese,malta,licensing;regulatory-compliance;responsible-gaming,http://iurismalta.com/,http://iurismalta.com/practice-areas/gaming-betting/ | https://mt.linkedin.com/company/iuris-malta,,true,false,published
mifsud-and-mifsud-advocates,Mifsud & Mifsud Advocates,"Valletta-based firm founded 2007 offering multidisciplinary practice including gaming law. Advises on gaming legislation, licensing, and commercial matters.",2007,1-10,"Valletta, Malta",English; Maltese,malta,licensing;regulatory-compliance;commercial-contracts,https://www.mifsudadvocates.com.mt/,http://www.mifsudadvocates.com.mt/gaming | https://iclg.com/firms/mifsud-and-mifsud,,true,false,published
vassallo-associates,Vassallo Associates,"Specialist multidisciplinary firm with strong litigation-led gaming practice. Advises operators on MGA investigations, regulatory compliance, and cross-border dispute resolution.",1870,11-50,"Valletta, Malta; United Kingdom",English,malta;united-kingdom,licensing;regulatory-compliance;litigation-disputes;aml-kyc,https://www.hvassallo.com/,https://www.hvassallo.com/practice-areas/igaming-law-malta/ | https://mt.linkedin.com/company/vassallo-associates,,true,false,published
wh-partners,WH Partners,Leading gaming and fintech law firm founded 2006 with pan-European expertise. Named CEE Gaming Law Firm of the Year 2026; advises major operators on compliance and M&A across jurisdictions.,2006,11-50,"Valletta, Malta; Rome, Italy; Bucharest, Romania; Malta; Italy; Romania; Czech Republic; Poland; UAE",English; Italian; Romanian,malta;italy,licensing;regulatory-compliance;aml-kyc;corporate-ma;tax;data-protection-gdpr,https://whpartners.eu/,https://whpartners.eu/industry/gaming-gambling/ | https://www.legal500.com/firms/16324-wh-partners/c-malta/about | https://whpartners.eu/about/ | https://chambers.com/law-firm/wh-partners-europe-7:250518,,true,true,published
akd-benelux-lawyers,AKD Benelux Lawyers,"Full-service Benelux firm with 500+ lawyers advising on gaming, betting and remote gambling regulations.",,200+,"Amsterdam, Netherlands; Breda, Netherlands; Eindhoven, Netherlands; Rotterdam, Netherlands; Brussels, Belgium; Luxembourg, Luxembourg",Dutch; English; French,netherlands;belgium,licensing;regulatory-compliance;commercial-contracts;tax,https://www.akd.eu/,https://www.akd.eu/industry/gaming-and-betting | https://www.akd.eu/insights/betting-and-gaming-act-in-the-netherlands | https://iclg.com/firms/akd-benelux-lawyers,,true,false,published
blenheim,Blenheim,"Medium-sized Amsterdam law firm advising on gaming licensing, KSA compliance, and gambling enforcement.",2001,51-200,"Amsterdam, Netherlands",Dutch; English,netherlands,licensing;regulatory-compliance;commercial-contracts;litigation-disputes;responsible-gaming,https://www.blenheim.nl/en/,https://www.blenheim.nl/en/about-us/about-blenheim/ | https://www.blenheim.nl/en/practice-areas/administrative-law/gaming-law/ | https://chambers.com/law-firm/bureau-brandeis-europe-7:22756486,,true,false,published
bureau-brandeis,Bureau Brandeis,"Specialist dispute resolution and regulatory practice advising on KSA enforcement, licensing and gaming litigation.",2013,51-200,"Amsterdam, Netherlands; Paris, France",Dutch; English; French,netherlands,licensing;regulatory-compliance;litigation-disputes;aml-kyc,https://bureaubrandeis.com/,https://www.legal500.com/firms/16825-bureau-brandeis/c-netherlands/about | https://chambers.com/law-firm/bureau-brandeis-europe-7:22756486 | https://bureaubrandeis.com/?lang=en,,true,false,published
franssen-tolboom,Franssen Tolboom,"Boutique gambling law firm specialising in gaming, fintech, sports and media with 25+ years sector experience.",2025,11-50,"Amsterdam, Netherlands",Dutch; English,netherlands,licensing;regulatory-compliance;aml-kyc;corporate-ma;payments-fintech;advertising-promotions;responsible-gaming;data-protection-gdpr;commercial-contracts;litigation-disputes,https://www.franssentolboom.nl/en/home-english/,https://www.franssentolboom.nl/en/law-firm-franssen-tolboom-launches-on-january-1-2025/ | https://practiceguides.chambers.com/practice-guides/gaming-law-2025/netherlands/trends-and-developments | https://iclg.com/firms/franssen-tolboom,,true,false,published
gaming-legal-group,Gaming Legal Group,"Global niche gaming specialist with litigation and compliance practices across Netherlands, Malta, and Curaçao.",2011,11-50,"Halfweg, Netherlands; Malta; Curaçao",Dutch; English,netherlands;malta;curacao,licensing;regulatory-compliance;litigation-disputes;aml-kyc;commercial-contracts,https://www.gaminglegalgroup.com/,https://www.gaminglegalgroup.com/ | https://iclg.com/firms/gaming-legal-group-glg-litigation | https://www.yelp.com/biz/gaming-legal-group-halfweg-2,,true,false,published
gofaizen-and-sherle,Gofaizen & Sherle,International FinTech and iGaming specialist assisting with Netherlands KSA licensing and compliance.,,11-50,"Tallinn, Estonia; Vilnius, Lithuania",English; Swedish,estonia;lithuania,licensing;regulatory-compliance;aml-kyc;payments-fintech;market-entry-strategy,https://gofaizen-sherle.com/,https://gofaizen-sherle.com/ | https://gofaizen-sherle.com/gambling-license/netherlands | https://gofaizen-sherle.com/about | https://gofaizen-sherle.com/gambling-license/sweden | https://gofaizen-sherle.com,,true,false,published
kalff-katz-and-franssen,Kalff Katz & Franssen,"Exclusive boutique specialising 25+ years in gaming and gambling law, media and entertainment sectors.",2001,11-50,"Amsterdam, Netherlands",Dutch; English,netherlands,licensing;regulatory-compliance;aml-kyc;corporate-ma;commercial-contracts;advertising-promotions;responsible-gaming,https://www.kalffkatzfranssen.nl/en/,https://www.kalffkatzfranssen.nl/en/about-us/ | https://iclg.com/firms/kalff-katz-and-franssen-advocaten | https://www.gaminglaw.eu/about/kalff-katz-franssen/,,true,true,published
law-and-more,Law and More,"Multidisciplinary Dutch firm advising on gambling licensing, KSA compliance, and regulatory requirements.",,11-50,"Amsterdam, Netherlands; Eindhoven, Netherlands",Dutch; English,netherlands,licensing;regulatory-compliance;commercial-contracts;corporate-ma,https://lawandmore.eu/,https://lawandmore.eu/about-us/ | https://lawandmore.eu/blog/the-dutch-gambling-act/,,true,false,published
stibbe,Stibbe,International full-service firm with public law expertise advising market leaders on gaming administration law.,,200+,"Amsterdam, Netherlands; Brussels, Belgium; Luxembourg, Luxembourg; London, United Kingdom; New York, United States",Dutch; English; French,netherlands;belgium;united-kingdom;united-states,regulatory-compliance;litigation-disputes;commercial-contracts,https://www.stibbe.com/,https://www.stibbe.com/ | https://chambers.com/law-firm/stibbe-europe-7:3874 | https://chambers.com/department/stibbe-public-law-europe-7:572:155:1:3874,,true,false,published
advokatbyr-n-gulliksson,Advokatbyrån Gulliksson,"Commercial law firm specializing in gaming and betting industry, advising participants and organizations on licensing.",1975,11-50,"Malmö, Sweden; Lund, Sweden",Swedish; English,sweden,licensing;regulatory-compliance;intellectual-property;commercial-contracts;advertising-promotions,https://www.gulliksson.se,https://www.gulliksson.se/en/services/gaming-and-betting/ | https://www.legal500.com/firms/11090-advokatbyran-gulliksson/11824-malmo-sweden/,,true,false,published
cirio,Cirio,"Business law firm with specialized gaming sector practice handling M&A, regulatory issues and operator compliance.",2019,51-200,"Stockholm, Sweden",Swedish; English,sweden,licensing;regulatory-compliance;corporate-ma;commercial-contracts;data-protection-gdpr,https://cirio.se,https://cirio.se/en/sectors/digital/gaming | https://chambers.com/law-firm/cirio-advokatbyra-ab-europe-7:23110472,,true,false,published
delorean-advokat,DeLorean Advokat,"Stockholm-based business law firm advising on gambling litigation, regulatory compliance and dispute resolution.",,1-10,"Stockholm, Sweden",Swedish; English,sweden,licensing;regulatory-compliance;litigation-disputes;commercial-contracts,https://www.delorean.law,https://www.delorean.law/case/swedish-gambling-casinos/ | https://www.delorean.law,,true,false,published
gernandt-and-danielsson,Gernandt & Danielsson,"Leading business law firm providing gaming law advisory, regulatory analysis and capital markets advice.",1992,51-200,"Stockholm, Sweden",Swedish; English,sweden,licensing;regulatory-compliance;commercial-contracts,https://gernandt-danielsson.se,https://www.legal500.com/guides/chapter/sweden-gambling-law/ | https://chambers.com/law-firm/gernandt-danielsson-advokatbyra-kb-global-2:4006,,true,false,published
lawyer-se,Lawyer.se,Video game and gaming law specialist firm representing game studios and developers on licensing and IP.,2001,1-10,"Åre, Sweden",Swedish; English,sweden,licensing;intellectual-property;commercial-contracts;skill-games-fantasy-sports,https://lawyer.se,https://lawyer.se | https://lawyer.se/video-game-attorney/,,true,false,published
mannheimer-swartling,Mannheimer Swartling,Nordic leading law firm with broad expertise in regulatory law and highly regulated sectors including gaming.,,200+,"Stockholm, Sweden; Gothenburg, Sweden; Malmö, Sweden",Swedish; English,sweden,regulatory-compliance;litigation-disputes;commercial-contracts,https://www.mannheimerswartling.se,https://www.mannheimerswartling.se/en/ | https://chambers.com/law-firm/mannheimer-swartling-europe-7:4024,,true,false,published
nur-legal,NUR Legal,Fintech and iGaming licensing specialist with multi-jurisdictional expertise including Swedish licensing.,,11-50,"Tallinn, Estonia",English; Swedish,estonia,licensing;regulatory-compliance;aml-kyc;market-entry-strategy,https://www.nur-legal.com,https://www.nur-legal.com/gambling-licenses/swedish-gambling-license | https://www.nur-legal.com/about-us,,true,false,published
schj-dt,Schjødt,Nordic law firm with Swedish office providing gambling law expertise and regulatory analysis.,,200+,"Stockholm, Sweden; Oslo, Norway; Copenhagen, Denmark",Swedish; English,sweden;norway;denmark,licensing;regulatory-compliance;litigation-disputes,https://schjodt.com,https://schjodt.com/news/gambling-new-landmark-ruling-from-the-swedish-supreme-court | https://www.legal500.com/firms/10502-advokatfirmaet-schjodt/c-sweden/about,,true,false,published
synch,Synch,"Forward-thinking tech law firm with gaming sector expertise in regulatory, IP and fintech matters.",2014,11-50,"Stockholm, Sweden",Swedish; English,sweden,licensing;regulatory-compliance;intellectual-property;data-protection-gdpr;payments-fintech,https://www.synch.law,https://www.synch.law | https://www.legal500.com/rankings/ranking/c-sweden/commercial-corporate-and-ma/17315-synch-law-ab,,true,false,published
vinge,Vinge,"Large full-service law firm with extensive expertise in gaming law, licensing agreements and regulatory compliance.",,200+,"Stockholm, Sweden; Gothenburg, Sweden; Malmö, Sweden",Swedish; English,sweden,licensing;regulatory-compliance;commercial-contracts;intellectual-property;advertising-promotions;sports-betting,https://www.vinge.se,https://www.vinge.se/en/expertise/practice-areas/sports-events-gaming-and-media/ | https://chambers.com/law-firm/advokatfirman-vinge-kb-europe-7:4035,,true,false,published
westerberg-and-partners,Westerberg & Partners,Boutique IP and dispute resolution firm with specialized gambling law team advising major Swedish operators.,2019,11-50,"Stockholm, Sweden",Swedish; English,sweden,licensing;regulatory-compliance;litigation-disputes;intellectual-property;commercial-contracts,https://westerberg.com,https://practiceguides.chambers.com/practice-guides/gaming-law-2025/sweden | https://www.legal500.com/firms/231729-westerberg-partners/231613-stockholm-sweden/,,true,false,published
wiklund-law,Wiklund Law,"Specialist EU and competition law firm with deep gaming expertise across sports betting, poker, casinos and lotteries.",,1-10,Sweden,Swedish; English,sweden,licensing;regulatory-compliance;commercial-contracts;sports-betting;poker;casino,https://www.wiklaw.eu,https://practiceguides.chambers.com/practice-guides/gaming-law-2024/sweden | https://www.wiklaw.eu,,true,false,published
bird-and-bird-llp,Bird & Bird LLP,"Global firm advising on all aspects of UK gambling regulation, licensing, compliance, and commercial transactions.",1846,200+,"London, United Kingdom; Brussels, Belgium; Frankfurt, Germany; Paris, France; Singapore",English,united-kingdom;germany;belgium,licensing;regulatory-compliance;advertising-promotions;data-protection-gdpr;commercial-contracts;corporate-ma,https://www.twobirds.com/en/gambling-law,https://www.legal500.com/rankings/ranking/c-london/crime-fraud-and-licensing/gaming-and-betting/342-bird-bird-llp | https://www.twobirds.com/en/gambling-law,,true,false,published
bryan-cave-leighton-paisner-bclp,Bryan Cave Leighton Paisner (BCLP),"Global firm handling licensing applications, regulatory enforcement, and complex gaming transactions for major operators.",2018,200+,"London, United Kingdom; New York, United States; Los Angeles, United States",English,united-kingdom;united-states,licensing;regulatory-compliance;corporate-ma;commercial-contracts;litigation-disputes,https://www.bclplaw.com/en-US/practices/regulation-compliance-and-advisory/betting-gaming.html,https://www.legal500.com/rankings/ranking/c-london/crime-fraud-and-licensing/gaming-and-betting/50162-bryan-cave-leighton-paisner | https://www.bclplaw.com/en-US/practices/regulation-compliance-and-advisory/betting-gaming.html,,true,false,published
cms,CMS,"Global firm with substantial gambling practice advising operators on regulatory matters, transactions and enforcement.",1999,200+,"London, United Kingdom; Manchester, United Kingdom; Birmingham, United Kingdom; Edinburgh, United Kingdom",English,united-kingdom,licensing;regulatory-compliance;aml-kyc;corporate-ma;data-protection-gdpr;commercial-contracts;sports-betting;responsible-gaming,https://cms.law/en/gbr/global-reach/europe/united-kingdom/expertise/tmt-technology-media-telecommunications/gambling,https://chambers.com/department/cms-gaming-uk-1:2730:11805:1:7489 | https://cms.law/en/gbr/global-reach/europe/united-kingdom/expertise/tmt-technology-media-telecommunications/gambling,,true,false,published
harris-hagan,Harris Hagan,"City of London specialist gambling firm with 20+ years experience in licensing, regulation and enforcement for all operator types.",2004,1-10,"London, United Kingdom",English,united-kingdom,licensing;regulatory-compliance;aml-kyc;responsible-gaming;corporate-ma,https://www.harrishagan.com/,https://chambers.com/law-firm/harris-hagan-uk-1:92969 | https://www.harrishagan.com/,,true,true,published
herbert-smith-freehills-kramer,Herbert Smith Freehills Kramer,"Global firm advising on UK gambling regulation, licensing, M&A and emerging issues like loot boxes and responsible gaming.",1882,200+,"London, United Kingdom; Belfast, United Kingdom; Paris, France; Munich, Germany",English,united-kingdom;germany,licensing;regulatory-compliance;corporate-ma;data-protection-gdpr;intellectual-property;commercial-contracts,https://www.hsfkramer.com/capabilities/sectors/media-entertainment-and-sport/gaming-and-gambling,https://www.legal500.com/c/london/crime-fraud-and-licensing/gaming-and-betting/ | https://www.hsfkramer.com/capabilities/sectors/media-entertainment-and-sport/gaming-and-gambling,,true,false,published
hugh-james,Hugh James,"Wales-based firm founded 1960 advising international operators on licensing, compliance and contentious gaming matters.",1960,51-200,"Cardiff, United Kingdom; London, United Kingdom; Manchester, United Kingdom",English; Welsh,united-kingdom,licensing;regulatory-compliance;commercial-contracts;litigation-disputes;intellectual-property,https://www.hughjames.com/services/gaming-gambling-law/,https://chambers.com/law-firm/hugh-james-uk-1:203 | https://www.hughjames.com/services/gaming-gambling-law/,,true,false,published
joelson-llp,Joelson LLP,"London firm since 1956 advising remote and land-based operators on licensing, compliance, age verification, and AML/KYC.",1956,11-50,"London, United Kingdom",English,united-kingdom,licensing;regulatory-compliance;aml-kyc;advertising-promotions;responsible-gaming,https://joelsonlaw.com/sectors/gambling-gaming-betting-law-team/,https://www.legal500.com/firms/1819-joelson/278-london-england/ | https://joelsonlaw.com/sectors/gambling-gaming-betting-law-team/,,true,false,published
keystone-law,Keystone Law,"Top 100 firm providing comprehensive gambling law advice on licensing, regulatory compliance, and contentious gaming matters.",2002,200+,"London, United Kingdom; Bristol, United Kingdom; Leeds, United Kingdom; Newcastle, United Kingdom; London; Bristol; Leeds; Manchester; Newcastle; Isle of Man; Adelaide; Brisbane; Canberra; Melbourne; Sydney",English,united-kingdom;isle-of-man,licensing;regulatory-compliance;corporate-ma;commercial-contracts;litigation-disputes,https://www.keystonelaw.com/sectors/gambling,https://chambers.com/department/keystone-law-gaming-uk-1:2730:11805:1:171702 | https://www.keystonelaw.com/sectors/gambling | https://keystonelaw.com/international/isle-of-man/ | https://www.legal500.com/c/isle-of-man,,true,false,published
memery-crystal,Memery Crystal,"London firm established 1978, advising on lottery schemes, gambling law interpretations, product classifications and disputes.",1978,11-50,"London, United Kingdom",English,united-kingdom,licensing;regulatory-compliance;litigation-disputes;intellectual-property,https://www.lexology.com/firms/2244,https://chambers.com/department/memery-crystal-gaming-uk-1:2730:11805:1:282 | https://www.legal500.com/firms/2322-memery-crystal/r-england/rankings,,true,false,published
mishcon-de-reya-llp,Mishcon de Reya LLP,"Tier 1-ranked firm advising operators on licensing, compliance, regulatory investigations, and complex commercial matters.",1988,200+,"London, United Kingdom; Cambridge, United Kingdom; Oxford, United Kingdom; Singapore; Dubai",English,united-kingdom,licensing;regulatory-compliance;aml-kyc;corporate-ma;litigation-disputes;responsible-gaming;skill-games-fantasy-sports,https://www.mishcon.com/services/betting,https://chambers.com/department/mishcon-de-reya-llp-gaming-uk-1:2730:11805:1:292 | https://www.mishcon.com/services/betting,,true,true,published
northridge-law-llp,Northridge Law LLP,"Specialist gaming firm providing regulatory expertise, compliance support, and dispute resolution for online and offline operators.",2017,11-50,"London, United Kingdom",English,united-kingdom,licensing;regulatory-compliance;aml-kyc;commercial-contracts;litigation-disputes,https://northridgelaw.com/work/betting-gaming/,https://chambers.com/law-firm/northridge-uk-1:23023873 | https://northridgelaw.com/work/betting-gaming/,,true,false,published
pinsent-masons-llp,Pinsent Masons LLP,"Global firm with gambling practice advising operators on regulatory compliance, licensing and emerging regulatory issues.",2003,200+,"London, United Kingdom; Manchester, United Kingdom; Edinburgh, United Kingdom; Glasgow, United Kingdom",English,united-kingdom,licensing;regulatory-compliance;aml-kyc;corporate-ma;commercial-contracts,https://www.pinsentmasons.com/out-law/topics/gambling,https://www.legal500.com/rankings/ranking/c-london/crime-fraud-and-licensing/gaming-and-betting/2251-pinsent-masons-llp | https://www.pinsentmasons.com/out-law/topics/gambling,,true,false,published
poppleston-allen,Poppleston Allen,"UK's largest licensing firm specializing in gambling regulation, compliance and licensing for online and land-based operators.",1994,51-200,"Nottingham, United Kingdom; London, United Kingdom",English,united-kingdom,licensing;regulatory-compliance;responsible-gaming,https://www.popall.co.uk/sectors/gambling-licensing,https://chambers.com/department/poppleston-allen-gaming-uk-1:2730:11805:1:332 | https://www.popall.co.uk/sectors/gambling-licensing,,true,false,published
wiggin-llp,Wiggin LLP,"Top-tier gaming firm advising operators on licensing, compliance, IP, M&A and regulatory matters.",2004,51-200,"Cheltenham, United Kingdom; London, United Kingdom; Brussels, Belgium",English,united-kingdom,licensing;regulatory-compliance;corporate-ma;commercial-contracts;litigation-disputes;intellectual-property;responsible-gaming,https://www.wiggin.co.uk/expertise/betting-and-gaming-law/,https://chambers.com/department/wiggin-llp-gaming-uk-1:2730:11805:1:1056 | https://www.wiggin.co.uk/expertise/betting-and-gaming-law/,,true,true,published
