slug,firm_name,short_description,founding_year,team_size_label,office_locations,languages,jurisdictions,practice_areas,website,sources,key_lawyer_slugs,verified,featured,status
woods-whur,Woods Whur,"Specialist gambling firm founded 2011, advising operators on licensing, compliance and regulatory matters for casino and betting sectors.",2011,11-50,"London, United Kingdom; Leeds, United Kingdom; Newcastle, United Kingdom",English,united-kingdom,licensing;regulatory-compliance;responsible-gaming,https://www.woodswhur.co.uk/,https://chambers.com/law-firm/woods-whur-uk-1:22566942 | https://www.woodswhur.co.uk/,,true,false,published
akerman-llp,Akerman LLP,"700-attorney Florida-based firm. Gaming team in Miami and Fort Lauderdale advises on gaming, entertainment, and regulatory matters.",1920,200+,"Miami, Florida; Fort Lauderdale, Florida; Tampa, Florida; Orlando, Florida",English,united-states,licensing;regulatory-compliance;sports-betting,https://www.akerman.com,https://www.akerman.com/en/work/services/sectors/sports-gaming-and-entertainment/index.html | https://chambers.com/law-firm/akerman-llp-usa-5:65304,,true,false,published
brownstein-hyatt-farber-schreck-llp,Brownstein Hyatt Farber Schreck LLP,"Full-service firm with leading gaming practice across Las Vegas, Atlantic City, and Denver. Top-ranked by Chambers USA nationally.",1968,200+,"Denver, Colorado; Las Vegas, Nevada; Atlantic City, New Jersey",English,united-states,licensing;regulatory-compliance;corporate-ma;litigation-disputes;commercial-contracts,https://www.bhfs.com,https://www.bhfs.com/about/history/ | https://chambers.com/law-firm/brownstein-hyatt-farber-schreck-llp-usa-5:65262,,true,false,published
covington-and-burling-llp,Covington & Burling LLP,"1,400+ attorney DC-headquartered international firm. Gaming practice handles complex M&A, litigation, and regulatory matters.",1919,200+,"Washington, District of Columbia; New York, New York; San Francisco, California; London, United Kingdom",English,united-states;united-kingdom,licensing;regulatory-compliance;corporate-ma;litigation-disputes;aml-kyc,https://www.cov.com,https://www.cov.com/en/practices-and-industries/industries/gaming | https://chambers.com/law-firm/covington-burling-llp-usa-5:3826,,true,false,published
cozen-oconnor,Cozen O'Connor,"1,000+ attorney firm with gaming practice spanning casino operations, fantasy sports, and online betting across 33 cities.",1970,200+,"Philadelphia, Pennsylvania; Las Vegas, Nevada; New York, New York; Washington, District of Columbia; Chicago, Illinois",English,united-states,licensing;regulatory-compliance;sports-betting;casino;skill-games-fantasy-sports,https://www.cozen.com,https://www.cozen.com/industries/gaming | https://law.usnews.com/law-firms/cozen-o-connor-660,,true,false,published
dickinson-wright-pllc,Dickinson Wright PLLC,"550+ attorney firm recognized by Chambers USA. Multi-disciplinary gaming team across Las Vegas, Reno, and other major jurisdictions.",1878,200+,"Detroit, Michigan; Las Vegas, Nevada; Reno, Nevada; Chicago, Illinois; Miami, Florida",English,united-states,licensing;regulatory-compliance;corporate-ma;litigation-disputes;market-entry-strategy,https://www.dickinson-wright.com,https://www.dickinson-wright.com/practice-areas/gaming-law | https://chambers.com/law-firm/dickinson-wright-pllc-usa-5:3837,,true,false,published
duane-morris-llp,Duane Morris LLP,"Philadelphia-headquartered firm with 29 offices. Gaming team handles regulatory licensing, sports betting, and iGaming matters.",1904,200+,"Philadelphia, Pennsylvania; New York, New York; Washington, District of Columbia; Chicago, Illinois",English,united-states,licensing;regulatory-compliance;sports-betting;casino;affiliate-compliance,https://www.duanemorris.com,https://www.duanemorris.com/practices/gaming.html | https://law.usnews.com/law-firms/duane-morris-llp-1347,,true,false,published
faegre-drinker-biddle-and-reath-llp,Faegre Drinker Biddle & Reath LLP,"1,300-attorney firm with sports and gaming expertise. Represents major US sports franchises and gaming operators on regulatory matters.",1849,200+,"Minneapolis, Minnesota; Philadelphia, Pennsylvania; Chicago, Illinois; Denver, Colorado; New York, New York",English,united-states,licensing;regulatory-compliance;corporate-ma;sports-betting;affiliate-compliance,https://www.faegredrinker.com,https://www.faegredrinker.com/en/insights/topics/sports-and-gaming | https://chambers.com/law-firm/faegre-drinker-biddle-reath-llp-usa-5:3587,,true,false,published
fox-rothschild-llp,Fox Rothschild LLP,"Multi-office national firm with dedicated gaming team serving casino operators, online gaming companies, and equipment manufacturers.",1907,200+,"Philadelphia, Pennsylvania; New York, New York; Washington, District of Columbia; Miami, Florida",English,united-states,licensing;regulatory-compliance;corporate-ma;litigation-disputes;commercial-contracts,https://www.foxrothschild.com,https://www.foxrothschild.com/gaming | https://law.usnews.com/law-firms/fox-rothschild-llp-703,,true,false,published
greenberg-traurig-llp,Greenberg Traurig LLP,"3,100-attorney international firm providing gaming regulatory and transactional advice across iGaming, tribal gaming, and licensing.",1967,200+,"Miami, Florida; Dallas, Texas; Chicago, Illinois; Washington, District of Columbia; New York, New York",English,united-states,licensing;regulatory-compliance;corporate-ma;litigation-disputes;commercial-contracts;sports-betting;casino,https://www.gtlaw.com,https://www.gtlaw.com/en/capabilities/gaming | https://chambers.com/law-firm/greenberg-traurig-llp-usa-5:3786,,true,false,published
holland-and-knight-llp,Holland & Knight LLP,"2,174-attorney firm with gaming practice across Miami, Tallahassee, and DC. Advises casinos, tribal entities, and operators.",1929,200+,"Tampa, Florida; Miami, Florida; Tallahassee, Florida; Washington, District of Columbia",English,united-states,licensing;regulatory-compliance;corporate-ma;litigation-disputes;sports-betting;casino,https://www.hklaw.com,https://www.hklaw.com/en/services/practices/litigation-and-dispute-resolution/gaming | https://law.usnews.com/law-firms/holland-knight-llp-1020,,true,false,published
ifrah-law-pllc,Ifrah Law PLLC,"Boutique DC firm specializing in iGaming, sports betting, and online gaming regulatory matters. Ranked Band 1 nationally by Chambers USA.",2009,1-10,"Washington, District of Columbia",English,united-states,licensing;regulatory-compliance;aml-kyc;sports-betting;casino;affiliate-compliance,https://www.ifrahlaw.com,https://www.ifrahlaw.com/ | https://chambers.com/law-firm/ifrah-law-usa-5:232884,,true,true,published
jones-walker-llp,Jones Walker LLP,"Louisiana-based firm with largest gaming practice in Southeast. Advises casinos, tribes, and gaming manufacturers on all regulatory matters.",1937,200+,"New Orleans, Louisiana; Baton Rouge, Louisiana; Lafayette, Louisiana; Lake Charles, Louisiana",English,united-states,licensing;regulatory-compliance;corporate-ma;litigation-disputes;market-entry-strategy,https://www.joneswalker.com,https://www.joneswalker.com/en/ | https://chambers.com/law-firm/jones-walker-llp-usa-5:65252,,true,false,published
k-and-l-gates-llp,K&L Gates LLP,"1,910-attorney global firm with betting and gaming practice. Team monitors US and international gaming regulatory developments.",2007,200+,"Washington, District of Columbia; New York, New York; Chicago, Illinois; San Francisco, California; Seattle, Washington",English,united-states,licensing;regulatory-compliance;sports-betting;casino;affiliate-compliance,https://www.klgates.com,https://www.klgates.com/betting-gaming | https://chambers.com/law-firm/kl-gates-usa-5:3581,,true,false,published
mcdonald-carano-llp,McDonald Carano LLP,"Nevada's most established gaming law firm since 1949. Advises on casino, mobile gaming, and restricted gaming regulatory matters.",1949,51-200,"Reno, Nevada; Las Vegas, Nevada; Carson City, Nevada",English,united-states,licensing;regulatory-compliance;casino;corporate-ma;commercial-contracts,https://www.mcdonaldcarano.com,https://www.mcdonaldcarano.com/practice-areas/gaming-administrative-law/ | https://chambers.com/law-firm/mcdonald-carano-usa-5:65649,,true,false,published
nelson-mullins-riley-and-scarborough-llp,Nelson Mullins Riley & Scarborough LLP,"Am Law 100 firm with 1,000+ attorneys. Gaming team advises operators, tribes, and vendors on regulatory and transactional matters.",1897,200+,"Columbia, South Carolina; Charleston, South Carolina; Greenville, South Carolina; Atlanta, Georgia",English,united-states,licensing;regulatory-compliance;corporate-ma;sports-betting;casino;affiliate-compliance,https://www.nelsonmullins.com,https://www.nelsonmullins.com/services/gaming2 | https://chambers.com/law-firm/nelson-mullins-riley-scarborough-llp-usa-5:1768,,true,false,published
orrick-herrington-and-sutcliffe-llp,Orrick Herrington & Sutcliffe LLP,"1,370-attorney firm with 30-year track record in iGaming and sports betting. Advises operators on M&A, regulatory, and compliance matters.",1863,200+,"San Francisco, California; New York, New York; Los Angeles, California; Washington, District of Columbia",English,united-states,licensing;regulatory-compliance;corporate-ma;sports-betting;casino;aml-kyc,https://www.orrick.com,https://www.orrick.com/en/Practices/Gaming-and-Gambling | https://law.usnews.com/law-firms/orrick-herrington-&-sutcliffe-llp-859,,true,false,published
saiber-llc,Saiber LLC,New Jersey gaming pioneer since 1978 Atlantic City legalization. Advises iGaming operators and sports wagering companies nationwide.,1950,51-200,"Madison, New Jersey; New York, New York; Philadelphia, Pennsylvania",English,united-states,licensing;regulatory-compliance;corporate-ma;sports-betting;casino;affiliate-compliance,https://www.saiber.com,https://www.saiber.com/services/regulatory-compliance/gaming-law | https://www.saiber.com/about/history,,true,false,published
womble-bond-dickinson-us-llp,Womble Bond Dickinson (US) LLP,"32+ US offices including Las Vegas. Gaming team advises on regulatory compliance, licensing, and litigation for gaming operators.",,200+,"Winston-Salem, North Carolina; Charlotte, North Carolina; Las Vegas, Nevada; Washington, District of Columbia; Atlanta, Georgia",English,united-states,licensing;regulatory-compliance;litigation-disputes;intellectual-property,https://www.womblebonddickinson.com/us,https://www.womblebonddickinson.com/us/sectors/gaming | https://chambers.com/law-firm/womble-bond-dickinson-us-llp-usa-5:2821,,true,false,published
zwillgen-pllc,ZwillGen PLLC,Washington DC-founded firm with 50 attorneys across 4 offices. Ranked Band 3 by Chambers USA for gaming and privacy law.,2010,11-50,"Washington, District of Columbia; New York, New York; Chicago, Illinois; San Francisco, California",English,united-states,licensing;regulatory-compliance;data-protection-gdpr;aml-kyc;sports-betting;advertising-promotions,https://www.zwillgen.com,https://www.zwillgen.com/ | https://chambers.com/law-firm/zwillgen-pllc-usa-5:237870,,true,false,published
